{
  "$schema": "https://json-schema.org/draft/2020-12/schema",
  "$id": "https://futurediff.dev/schemas/compatibility/manifest-0.1.json",
  "type": "object",
  "additionalProperties": false,
  "required": ["format_version"],
  "properties": {
    "format_version": {"const": "0.1"},
    "api_contracts": {"type": "array", "items": {"type": "string"}},
    "verification_contracts": {"type": "array", "items": {"type": "string"}},
    "effectspec_descriptors": {"type": "array", "items": {"type": "string"}},
    "policy_bundles": {"type": "array", "items": {"type": "string"}},
    "configs": {
      "type": "array",
      "items": {
        "type": "object",
        "additionalProperties": false,
        "required": ["path", "kind"],
        "properties": {"path": {"type": "string"}, "kind": {"type": "string"}}
      }
    }
  }
}
